{
  "$schema": "https://json-schema.org/draft/2020-12/schema",
  "$id": "schemas/samples/schema_v1.json",
  "title": "Lattice Sample Schema v1",
  "type": "object",
  "additionalProperties": false,
  "required": [
    "paper_id",
    "sample_id",
    "structure_main_class",
    "structure_subtype_list",
    "needs_manual_review",
    "review_status"
  ],
  "properties": {
    "paper_id": {
      "type": "string",
      "minLength": 1
    },
    "sample_id": {
      "type": "string",
      "minLength": 1
    },
    "doi": {
      "type": [
        "string",
        "null"
      ]
    },
    "title": {
      "type": [
        "string",
        "null"
      ]
    },
    "sample_label_in_paper": {
      "type": [
        "string",
        "null"
      ]
    },
    "is_multi_sample_paper": {
      "type": [
        "boolean",
        "null"
      ]
    },
    "raw_design": {
      "type": [
        "string",
        "null"
      ]
    },
    "raw_structure": {
      "type": [
        "string",
        "null"
      ]
    },
    "raw_type": {
      "type": [
        "string",
        "null"
      ]
    },
    "structure_main_class": {
      "type": "string",
      "enum": [
        "truss_lattice",
        "tpms",
        "honeycomb_2d",
        "plate_lattice",
        "tube_lattice",
        "hybrid_lattice",
        "bioinspired",
        "voronoi",
        "unknown"
      ]
    },
    "structure_subtype_list": {
      "type": "array",
      "items": {
        "type": "string"
      }
    },
    "is_hierarchical": {
      "type": [
        "boolean",
        "null"
      ]
    },
    "is_graded": {
      "type": [
        "boolean",
        "null"
      ]
    },
    "is_optimized": {
      "type": [
        "boolean",
        "null"
      ]
    },
    "relative_density_raw": {
      "type": [
        "string",
        "null"
      ]
    },
    "relative_density_value": {
      "type": [
        "number",
        "null"
      ]
    },
    "raw_material": {
      "type": [
        "string",
        "null"
      ]
    },
    "raw_material_group": {
      "type": [
        "string",
        "null"
      ]
    },
    "material_canonical": {
      "type": [
        "string",
        "null"
      ]
    },
    "material_family": {
      "type": "string",
      "enum": [
        "aluminum_alloy",
        "stainless_steel",
        "titanium_alloy",
        "polymer",
        "resin",
        "ni_ti_shape_memory",
        "magnesium_alloy",
        "steel",
        "composite_polymer",
        "unknown"
      ]
    },
    "raw_process": {
      "type": [
        "string",
        "null"
      ]
    },
    "process_canonical": {
      "type": [
        "string",
        "null"
      ]
    },
    "process_family": {
      "type": "string",
      "enum": [
        "slm",
        "sls",
        "sla",
        "fdm",
        "forming_and_assembly",
        "unknown"
      ]
    },
    "analysis_type": {
      "type": "string",
      "enum": [
        "experimental",
        "numerical",
        "experimental_numerical",
        "unknown"
      ]
    },
    "test_mode": {
      "type": "string",
      "enum": [
        "quasi_static",
        "impact",
        "dynamic",
        "unknown"
      ]
    },
    "loading_direction": {
      "type": "string",
      "enum": [
        "uniaxial",
        "biaxial",
        "lateral",
        "concentrated_load",
        "unknown"
      ]
    },
    "velocity_m_s_raw": {
      "type": [
        "string",
        "null"
      ]
    },
    "velocity_m_s": {
      "type": [
        "number",
        "null"
      ]
    },
    "sea_j_g_raw": {
      "type": [
        "string",
        "null"
      ]
    },
    "sea_j_g": {
      "type": [
        "number",
        "null"
      ]
    },
    "pcf_kn_raw": {
      "type": [
        "string",
        "null"
      ]
    },
    "pcf_kn": {
      "type": [
        "number",
        "null"
      ]
    },
    "mcf_kn_raw": {
      "type": [
        "string",
        "null"
      ]
    },
    "mcf_kn": {
      "type": [
        "number",
        "null"
      ]
    },
    "cfe_raw": {
      "type": [
        "string",
        "null"
      ]
    },
    "cfe": {
      "type": [
        "number",
        "null"
      ]
    },
    "plateau_stress_mpa_raw": {
      "type": [
        "string",
        "null"
      ]
    },
    "plateau_stress_mpa": {
      "type": [
        "number",
        "null"
      ]
    },
    "confidence_overall": {
      "type": [
        "number",
        "null"
      ],
      "minimum": 0,
      "maximum": 1
    },
    "needs_manual_review": {
      "type": "boolean"
    },
    "review_status": {
      "type": "string",
      "enum": [
        "pending",
        "reviewed",
        "accepted",
        "rejected"
      ]
    },
    "review_notes": {
      "type": [
        "string",
        "null"
      ]
    }
  }
}
