{
  "paper_id": "10_1016_j_engstruct_2023_116510",
  "sample_id": "10_1016_j_engstruct_2023_116510-knee-b7p71-d2p00",
  "doi": "10.1016/j.engstruct.2023.116510",
  "title": "On vibration isolation performance and crashworthiness of a three-dimensional lattice metamaterial",
  "sample_label_in_paper": "knee point",
  "is_multi_sample_paper": true,
  "raw_design": "b=7.71 mm, d=2.00 mm",
  "raw_structure": "hollow rhombic dodecahedron and six cylindrical tubes",
  "raw_type": "lattice",
  "structure_main_class": "hybrid_lattice",
  "structure_subtype_list": [
    "rhombic_dodecahedron",
    "cylindrical_tube"
  ],
  "is_hierarchical": false,
  "is_graded": false,
  "is_optimized": true,
  "relative_density_raw": null,
  "relative_density_value": null,
  "raw_material": "316L stainless steel",
  "raw_material_group": "stainless_steel",
  "material_canonical": "316L stainless steel",
  "material_family": "stainless_steel",
  "raw_process": "COMSOL Multiphysics / LS-DYNA",
  "process_canonical": "COMSOL Multiphysics / LS-DYNA",
  "process_family": "unknown",
  "analysis_type": "experimental_numerical",
  "test_mode": "dynamic",
  "loading_direction": "uniaxial",
  "velocity_m_s_raw": "15 m/s",
  "velocity_m_s": 15.0,
  "sea_j_g_raw": "23.66",
  "sea_j_g": 23.66,
  "pcf_kn_raw": "461.54",
  "pcf_kn": 461.54,
  "mcf_kn_raw": null,
  "mcf_kn": null,
  "cfe_raw": null,
  "cfe": null,
  "plateau_stress_mpa_raw": null,
  "plateau_stress_mpa": null,
  "confidence_overall": 0.95,
  "needs_manual_review": true,
  "review_status": "pending",
  "review_notes": "Paper-derived seed from PDF corpus for TASK-019."
}
