{
  "paper_id": "10_1016_j_compstruct_2018_03_050",
  "sample_id": "10_1016_j_compstruct_2018_03_050-n2-r0125-triangular-hierarchical",
  "doi": "10.1016/j.compstruct.2018.03.050",
  "title": "In-plane crashworthiness of bio-inspired hierarchical honeycombs",
  "sample_label_in_paper": "Triangular N=2 r=1/8",
  "is_multi_sample_paper": true,
  "raw_design": "N=2, r=1/8",
  "raw_structure": "triangular hierarchical honeycomb",
  "raw_type": "honeycomb",
  "structure_main_class": "honeycomb_2d",
  "structure_subtype_list": [
    "bioinspired",
    "hierarchical",
    "triangular"
  ],
  "is_hierarchical": true,
  "is_graded": false,
  "is_optimized": false,
  "relative_density_raw": "0.05",
  "relative_density_value": 0.05,
  "raw_material": "AA3030-H19",
  "raw_material_group": "aluminum",
  "material_canonical": "Aluminum alloy",
  "material_family": "aluminum_alloy",
  "raw_process": "LS-DYNA",
  "process_canonical": "LS-DYNA",
  "process_family": "unknown",
  "analysis_type": "numerical",
  "test_mode": "quasi_static",
  "loading_direction": "lateral",
  "velocity_m_s_raw": "5 m/s",
  "velocity_m_s": 5.0,
  "sea_j_g_raw": null,
  "sea_j_g": null,
  "pcf_kn_raw": null,
  "pcf_kn": null,
  "mcf_kn_raw": null,
  "mcf_kn": null,
  "cfe_raw": null,
  "cfe": null,
  "plateau_stress_mpa_raw": null,
  "plateau_stress_mpa": null,
  "confidence_overall": 0.9,
  "needs_manual_review": true,
  "review_status": "pending",
  "review_notes": "Paper-derived seed from PDF corpus for TASK-017."
}
