{
  "paper_id": "pii_s0734_743x_97_00040_7",
  "sample_id": "pii_s0734_743x_97_00040_7-al-honeycomb",
  "doi": null,
  "title": "STATIC AND DYNAMIC PROPERTIES OF HIGH-DENSITY METAL HONEYCOMBS",
  "sample_label_in_paper": "al-honeycomb",
  "is_multi_sample_paper": true,
  "raw_design": "76.2 mm long al-honeycomb specimen, 50.8 mm maximum diameter",
  "raw_structure": "aluminum honeycomb",
  "raw_type": "honeycomb",
  "structure_main_class": "honeycomb_2d",
  "structure_subtype_list": [
    "high_density",
    "hexagonal",
    "aluminum"
  ],
  "is_hierarchical": false,
  "is_graded": false,
  "is_optimized": false,
  "relative_density_raw": "32 % of solid aluminum",
  "relative_density_value": 32.0,
  "raw_material": "5052 aluminum",
  "raw_material_group": "aluminum",
  "material_canonical": "5052 aluminum",
  "material_family": "aluminum_alloy",
  "raw_process": "furnace-brazed",
  "process_canonical": "furnace-brazed",
  "process_family": "forming_and_assembly",
  "analysis_type": "experimental",
  "test_mode": "quasi_static",
  "loading_direction": "uniaxial",
  "velocity_m_s_raw": "0.025 mm/s",
  "velocity_m_s": 2.5e-05,
  "sea_j_g_raw": null,
  "sea_j_g": null,
  "pcf_kn_raw": null,
  "pcf_kn": null,
  "mcf_kn_raw": null,
  "mcf_kn": null,
  "cfe_raw": null,
  "cfe": null,
  "plateau_stress_mpa_raw": null,
  "plateau_stress_mpa": null,
  "confidence_overall": 0.9,
  "needs_manual_review": true,
  "review_status": "pending",
  "review_notes": "Paper-derived seed from PDF corpus for TASK-025."
}
