{
  "paper_id": "10_1016_j_ijimpeng_2025_105321",
  "sample_id": "10_1016_j_ijimpeng_2025_105321-hprl-qstatic-r022",
  "doi": "10.1016/j.ijimpeng.2025.105321",
  "title": "Response of hybrid plate-rod lattices to static and dynamic compression–An experimental study",
  "sample_label_in_paper": "HPRL",
  "is_multi_sample_paper": true,
  "raw_design": "4 × 4 × 4 cell assembly, 24 mm cube",
  "raw_structure": "HPRL",
  "raw_type": "lattice",
  "structure_main_class": "hybrid_lattice",
  "structure_subtype_list": [
    "plate_rod",
    "octet"
  ],
  "is_hierarchical": false,
  "is_graded": false,
  "is_optimized": false,
  "relative_density_raw": "0.22",
  "relative_density_value": 0.22,
  "raw_material": "17-4PH stainless steel",
  "raw_material_group": "stainless_steel",
  "material_canonical": "17-4PH stainless steel",
  "material_family": "stainless_steel",
  "raw_process": "SLM",
  "process_canonical": "SLM",
  "process_family": "slm",
  "analysis_type": "experimental",
  "test_mode": "quasi_static",
  "loading_direction": "uniaxial",
  "velocity_m_s_raw": "0.024 mm/s",
  "velocity_m_s": 2.4e-05,
  "sea_j_g_raw": "11.2 J/g",
  "sea_j_g": 11.2,
  "pcf_kn_raw": null,
  "pcf_kn": null,
  "mcf_kn_raw": null,
  "mcf_kn": null,
  "cfe_raw": null,
  "cfe": null,
  "plateau_stress_mpa_raw": "38.7 MPa",
  "plateau_stress_mpa": 38.7,
  "confidence_overall": 0.93,
  "needs_manual_review": true,
  "review_status": "pending",
  "review_notes": "Paper-derived seed from PDF corpus for TASK-022."
}
