{
  "paper_id": "10_1016_j_jmrt_2023_05_167",
  "sample_id": "10_1016_j_jmrt_2023_05_167-p1l-tpms-primitive",
  "doi": "10.1016/j.jmrt.2023.05.167",
  "title": "Anisotropic structure-property relations of FDM printed short glass fiber reinforced polyamide TPMS structures under quasi-static compression",
  "sample_label_in_paper": "P1L",
  "is_multi_sample_paper": true,
  "raw_design": "Primitive",
  "raw_structure": "TPMS",
  "raw_type": "TPMS",
  "structure_main_class": "tpms",
  "structure_subtype_list": [
    "primitive"
  ],
  "is_hierarchical": false,
  "is_graded": false,
  "is_optimized": false,
  "relative_density_raw": "0.27",
  "relative_density_value": 0.27,
  "raw_material": "short glass fiber reinforced polyamide",
  "raw_material_group": "polyamide",
  "material_canonical": "Polyamide",
  "material_family": "polymer",
  "raw_process": "FDM",
  "process_canonical": "FDM",
  "process_family": "fdm",
  "analysis_type": "experimental",
  "test_mode": "quasi_static",
  "loading_direction": "uniaxial",
  "velocity_m_s_raw": null,
  "velocity_m_s": null,
  "sea_j_g_raw": "1.41",
  "sea_j_g": 1.41,
  "pcf_kn_raw": null,
  "pcf_kn": null,
  "mcf_kn_raw": null,
  "mcf_kn": null,
  "cfe_raw": null,
  "cfe": null,
  "plateau_stress_mpa_raw": null,
  "plateau_stress_mpa": null,
  "confidence_overall": 0.9,
  "needs_manual_review": true,
  "review_status": "pending",
  "review_notes": "Paper-derived seed from PDF corpus for TASK-011."
}
