{
  "paper_id": "10_1016_j_cirpj_2024_06_009",
  "sample_id": "10_1016_j_cirpj_2024_06_009-octet-10x10x10-d0p40-r015",
  "doi": "10.1016/j.cirpj.2024.06.009",
  "title": "Comparative study on the process, anisotropy, and mechanical performance of laser powder bed fusion fabricated truss-lattice structures with different unit cell designs",
  "sample_label_in_paper": "Octet",
  "is_multi_sample_paper": true,
  "raw_design": "10 × 10 × 10 mm, 0.40 mm strut diameter",
  "raw_structure": "Octet",
  "raw_type": "lattice",
  "structure_main_class": "truss_lattice",
  "structure_subtype_list": [
    "octet"
  ],
  "is_hierarchical": false,
  "is_graded": false,
  "is_optimized": false,
  "relative_density_raw": "15 %",
  "relative_density_value": 15.0,
  "raw_material": "316L stainless steel",
  "raw_material_group": "stainless_steel",
  "material_canonical": "316L stainless steel",
  "material_family": "stainless_steel",
  "raw_process": "LPBF",
  "process_canonical": "LPBF",
  "process_family": "slm",
  "analysis_type": "experimental_numerical",
  "test_mode": "quasi_static",
  "loading_direction": "uniaxial",
  "velocity_m_s_raw": "2 mm/min",
  "velocity_m_s": 3.3333333333333335e-05,
  "sea_j_g_raw": "18.1 J/g",
  "sea_j_g": 18.1,
  "pcf_kn_raw": null,
  "pcf_kn": null,
  "mcf_kn_raw": null,
  "mcf_kn": null,
  "cfe_raw": null,
  "cfe": null,
  "plateau_stress_mpa_raw": null,
  "plateau_stress_mpa": null,
  "confidence_overall": 0.93,
  "needs_manual_review": true,
  "review_status": "pending",
  "review_notes": "Paper-derived seed from PDF corpus for TASK-021."
}
