{
  "paper_id": "10_1016_j_jmrt_2021_08_092",
  "sample_id": "10_1016_j_jmrt_2021_08_092-radial-hybrid-r016",
  "doi": "10.1016/j.jmrt.2021.08.092",
  "title": "Development of novel hybrid TPMS cellular lattices and their mechanical characterisation",
  "sample_label_in_paper": "Radial hybrid",
  "is_multi_sample_paper": true,
  "raw_design": "radial hybrid",
  "raw_structure": "Diamond/Gyroid hybrid TPMS lattice",
  "raw_type": "TPMS",
  "structure_main_class": "tpms",
  "structure_subtype_list": [
    "diamond",
    "gyroid",
    "hybrid",
    "radial"
  ],
  "is_hierarchical": false,
  "is_graded": false,
  "is_optimized": false,
  "relative_density_raw": "16%",
  "relative_density_value": 0.16,
  "raw_material": "316L stainless steel",
  "raw_material_group": "stainless_steel",
  "material_canonical": "316L stainless steel",
  "material_family": "stainless_steel",
  "raw_process": "LPBF",
  "process_canonical": "LPBF",
  "process_family": "slm",
  "analysis_type": "experimental_numerical",
  "test_mode": "quasi_static",
  "loading_direction": "uniaxial",
  "velocity_m_s_raw": "0.1 mm/s",
  "velocity_m_s": 0.0001,
  "sea_j_g_raw": "9.96 J/g",
  "sea_j_g": 9.96,
  "pcf_kn_raw": null,
  "pcf_kn": null,
  "mcf_kn_raw": null,
  "mcf_kn": null,
  "cfe_raw": null,
  "cfe": null,
  "plateau_stress_mpa_raw": "33.53 MPa",
  "plateau_stress_mpa": 33.53,
  "confidence_overall": 0.94,
  "needs_manual_review": true,
  "review_status": "pending",
  "review_notes": "Paper-derived seed from PDF corpus for TASK-026."
}
