{
  "paper_id": "10_1016_j_addma_2022_102887",
  "sample_id": "10_1016_j_addma_2022_102887-i2o-2-mgo",
  "doi": "10.1016/j.addma.2022.102887",
  "title": "Enhancing specific energy absorption of additively manufactured titanium lattice structures through simultaneous manipulation of architecture and constituent material",
  "sample_label_in_paper": "I2O-2-MgO",
  "is_multi_sample_paper": true,
  "raw_design": "I2O-2-MgO",
  "raw_structure": "gyroid",
  "raw_type": "TPMS",
  "structure_main_class": "tpms",
  "structure_subtype_list": [
    "gyroid",
    "graded"
  ],
  "is_hierarchical": false,
  "is_graded": true,
  "is_optimized": false,
  "relative_density_raw": "36.58",
  "relative_density_value": 36.58,
  "raw_material": "MgO-doped CP Ti",
  "raw_material_group": "titanium",
  "material_canonical": "CP Ti",
  "material_family": "unknown",
  "raw_process": "L-PBF",
  "process_canonical": "L-PBF",
  "process_family": "unknown",
  "analysis_type": "experimental_numerical",
  "test_mode": "unknown",
  "loading_direction": "uniaxial",
  "velocity_m_s_raw": null,
  "velocity_m_s": null,
  "sea_j_g_raw": "28.5",
  "sea_j_g": 28.5,
  "pcf_kn_raw": null,
  "pcf_kn": null,
  "mcf_kn_raw": null,
  "mcf_kn": null,
  "cfe_raw": null,
  "cfe": null,
  "plateau_stress_mpa_raw": null,
  "plateau_stress_mpa": null,
  "confidence_overall": 0.89,
  "needs_manual_review": true,
  "review_status": "pending",
  "review_notes": "Paper-derived seed from PDF corpus for TASK-012."
}
