{
  "paper_id": "10_1016_j_ijimpeng_2023_104713",
  "sample_id": "10_1016_j_ijimpeng_2023_104713-design1-reinforced-hexagonal-lattice",
  "doi": "10.1016/j.ijimpeng.2023.104713",
  "title": "Crashworthiness analysis and multi-objective optimization of spatial lattice structure under dynamic compression",
  "sample_label_in_paper": "Design 1",
  "is_multi_sample_paper": true,
  "raw_design": "L=8, I=9, J=1.8, theta=119, T=2, nx=4, ny=5, nz=8",
  "raw_structure": "reinforced hexagonal lattice",
  "raw_type": "lattice",
  "structure_main_class": "bioinspired",
  "structure_subtype_list": [
    "bionic_honeycomb",
    "hexagonal",
    "reinforced"
  ],
  "is_hierarchical": false,
  "is_graded": false,
  "is_optimized": true,
  "relative_density_raw": null,
  "relative_density_value": null,
  "raw_material": "AA6061-T6",
  "raw_material_group": "aluminum",
  "material_canonical": "Aluminum alloy 6061-T6",
  "material_family": "aluminum_alloy",
  "raw_process": "LS-DYNA",
  "process_canonical": "LS-DYNA",
  "process_family": "unknown",
  "analysis_type": "numerical",
  "test_mode": "dynamic",
  "loading_direction": "uniaxial",
  "velocity_m_s_raw": "15 km/h",
  "velocity_m_s": 4.1667,
  "sea_j_g_raw": "24.445",
  "sea_j_g": 24.445,
  "pcf_kn_raw": "58.519",
  "pcf_kn": 58.519,
  "mcf_kn_raw": null,
  "mcf_kn": null,
  "cfe_raw": null,
  "cfe": null,
  "plateau_stress_mpa_raw": null,
  "plateau_stress_mpa": null,
  "confidence_overall": 0.94,
  "needs_manual_review": true,
  "review_status": "pending",
  "review_notes": "Paper-derived seed from PDF corpus for TASK-018."
}
