{
  "paper_id": "10_1016_j_tws_2020_106623",
  "sample_id": "10_1016_j_tws_2020_106623-sth-r015-v1",
  "doi": "10.1016/j.tws.2020.106623",
  "title": "A novel star auxetic honeycomb with enhanced in-plane crushing strength",
  "sample_label_in_paper": "STH",
  "is_multi_sample_paper": true,
  "raw_design": "STH",
  "raw_structure": "star-triangular honeycomb",
  "raw_type": "honeycomb",
  "structure_main_class": "honeycomb_2d",
  "structure_subtype_list": [
    "auxetic",
    "star",
    "triangular"
  ],
  "is_hierarchical": false,
  "is_graded": false,
  "is_optimized": false,
  "relative_density_raw": "0.15",
  "relative_density_value": 0.15,
  "raw_material": "aluminum alloy 6061O",
  "raw_material_group": "aluminum",
  "material_canonical": "Aluminum alloy",
  "material_family": "aluminum_alloy",
  "raw_process": "LS-DYNA",
  "process_canonical": "LS-DYNA",
  "process_family": "unknown",
  "analysis_type": "numerical",
  "test_mode": "quasi_static",
  "loading_direction": "lateral",
  "velocity_m_s_raw": "1",
  "velocity_m_s": 1.0,
  "sea_j_g_raw": null,
  "sea_j_g": null,
  "pcf_kn_raw": null,
  "pcf_kn": null,
  "mcf_kn_raw": null,
  "mcf_kn": null,
  "cfe_raw": null,
  "cfe": null,
  "plateau_stress_mpa_raw": "1.1928",
  "plateau_stress_mpa": 1.1928,
  "confidence_overall": 0.9,
  "needs_manual_review": true,
  "review_status": "pending",
  "review_notes": "Paper-derived seed from PDF corpus for TASK-014."
}
