{
  "paper_id": "10_1016_j_compstruct_2019_111219",
  "sample_id": "10_1016_j_compstruct_2019_111219-psh-a5-b1p568-t0p3",
  "doi": "10.1016/j.compstruct.2019.111219",
  "title": "In-plane dynamic crushing of a novel circular-celled honeycomb nested with petal-shaped mesostructure",
  "sample_label_in_paper": "PSH",
  "is_multi_sample_paper": true,
  "raw_design": "PSH",
  "raw_structure": "petal-shaped honeycomb",
  "raw_type": "honeycomb",
  "structure_main_class": "honeycomb_2d",
  "structure_subtype_list": [
    "circular_celled",
    "petal_shaped",
    "nested"
  ],
  "is_hierarchical": false,
  "is_graded": false,
  "is_optimized": false,
  "relative_density_raw": "0.196",
  "relative_density_value": 0.196,
  "raw_material": "aluminum alloy",
  "raw_material_group": "aluminum",
  "material_canonical": "Aluminum alloy",
  "material_family": "aluminum_alloy",
  "raw_process": "LS-DYNA",
  "process_canonical": "LS-DYNA",
  "process_family": "unknown",
  "analysis_type": "numerical",
  "test_mode": "quasi_static",
  "loading_direction": "lateral",
  "velocity_m_s_raw": "1",
  "velocity_m_s": 1.0,
  "sea_j_g_raw": "4.12808",
  "sea_j_g": 4.12808,
  "pcf_kn_raw": null,
  "pcf_kn": null,
  "mcf_kn_raw": null,
  "mcf_kn": null,
  "cfe_raw": null,
  "cfe": null,
  "plateau_stress_mpa_raw": "4.568",
  "plateau_stress_mpa": 4.568,
  "confidence_overall": 0.9,
  "needs_manual_review": true,
  "review_status": "pending",
  "review_notes": "Paper-derived seed from PDF corpus for TASK-013."
}
