{
  "paper_id": "10_3390_ma18040732",
  "sample_id": "10_3390_ma18040732-bccz-cross-4x4x5",
  "doi": "10.3390/ma18040732",
  "title": "Enhancement of Energy Absorption Capability of 3D Printed Ti-6Al-4V BCC Lattice Structures by Adding Auxiliary Struts",
  "sample_label_in_paper": "BCCz+cross",
  "is_multi_sample_paper": true,
  "raw_design": "4 × 4 × 5 lattice structure, 12 mm unit cell",
  "raw_structure": "BCCz+cross",
  "raw_type": "lattice",
  "structure_main_class": "truss_lattice",
  "structure_subtype_list": [
    "bcc",
    "bccz",
    "auxiliary_struts",
    "cross"
  ],
  "is_hierarchical": false,
  "is_graded": false,
  "is_optimized": true,
  "relative_density_raw": null,
  "relative_density_value": null,
  "raw_material": "Ti-6Al-4V Grade 5",
  "raw_material_group": "titanium",
  "material_canonical": "Ti-6Al-4V",
  "material_family": "titanium_alloy",
  "raw_process": "EBM",
  "process_canonical": "EBM",
  "process_family": "unknown",
  "analysis_type": "experimental_numerical",
  "test_mode": "quasi_static",
  "loading_direction": "uniaxial",
  "velocity_m_s_raw": "60 mm/sec",
  "velocity_m_s": 0.06,
  "sea_j_g_raw": "2.68 × 10^3",
  "sea_j_g": 2.68,
  "pcf_kn_raw": null,
  "pcf_kn": null,
  "mcf_kn_raw": "4.68 × 10^2",
  "mcf_kn": 468.0,
  "cfe_raw": null,
  "cfe": null,
  "plateau_stress_mpa_raw": null,
  "plateau_stress_mpa": null,
  "confidence_overall": 0.94,
  "needs_manual_review": true,
  "review_status": "pending",
  "review_notes": "Paper-derived seed from PDF corpus for TASK-020."
}
